rank,title,description,url,score,reason,level,type
1,"포스트 코로나, 코로나 이후 온라인 미술시장","코로나 팬데믹 이후, 전염병의 창궐 속에서 개인의 건강과 안녕을 위한 수단으로 '언택트 경제' 비대면 경제활동이 주요 이슈가 되면서, 쿠팡, 마켓컬리 같은 온라인 마켓이 생필품을 구매하기 위한 주요 수단으로 부상했다. 이처럼 코로나가 야기한 집합과 국가간 이동제한은 사회 전반적인 활동에 지대한 영향을 미쳤으며 사람들의 행동 방식과 소비습관, 나아가서는 라이프 스타일에까지 큰 변화를 불러왔다. 미술시장 역시 많은 변화를 맞이했다. 집합의 제한, 국가간 이동의 제한 상황 발생은 미술시장 규모에 일차적으로 타격을 입혔으며 나아가 작품이 거래되는 방식, 거래되는 작품의 특성, 작품을 구매하는 사람에게 까지 영향을 미치고 있다. 본 논문에서는 코로나가 미술시장에 미친 영향을 온라인 미술시장 중심으로 살펴보고, 앞으로 야기할 변화와 대응방식을 모색해보고자 한다.",http://click.ndsl.kr/servlet/OpenAPIDetailView?keyValue=05787966&target=NART&cn=JAKO202109950460817,0.7774,"공통 키워드: 사람들의, 불러왔다, 중심으로, 변화를, 온라인, 건강과",강추,paper
2,코로나19 이후 소비.미디어 이용행태 변화와 코로나 우울에 관한 연구,"본 연구결과를 요약하면 다음과 같다. &amp;#xD; 첫째, 코로나19이후 소비행태에는 변화가 존재하는 소비품목이 존재하였다. 구체적으로, ‘식료품비’는 코로나19 이후 2020년에 소비비중이 증가하였고, 주류담배비, 오락문화비, 외식숙박비는 코로나19이전보다 이후가 더 감소하였다. 의류비, 주거비, 가정용품비, 통신비, 보건비, 교육비,교통비는 코로나19이전과 이후에 차이가 없었다.&amp;#xD; 둘째, 코로나19이후 미디어 이용행태에 증가 혹은 감소 변화가 존재하는 미디어 유형이 존재하였다. ‘유료OTT 서비스 이용’만 코로나19 이후 2020년이 더 높게 나타났고, ‘공중지상파 및 케이블 TV 시청’는 코로나19이후 2020년에 큰 폭으로 감소하였다. 나머지(인터넷정보검색 및 인터넷쇼핑, SNS 이용, 유튜브(You Tube) 시청, 미디어 채널에서의 1인방송 시청, 신문 및 잡지 읽기, 라디오 청취)는 차이가 없었다. &amp;#xD; 셋째, 인구통계적 변수에 따른 코로나우울이 차이가 존재하는지 검증한 결과, 성별만 코로나 우울에서 차이는 보이고, 나머지(연령대, 직업, 가구형태, 혼인형태)는 코로나 우울에 있어서 차이가 존재하지 않고 있다. 성별의 경우, 여성이 남성보다 더 코로나 우울을 경험하는 것으로 나타났다. &amp;#xD; 마지막으로 개인 성향 변수(조절초점, 자아해석 성향)에 따라 경험하는 코로나 우울에서 어떠한 차이가 있는지 검증한 결과, 예방초점자들이 향상초점자보다 더 코로나 우울을 경험하고 있으며, 상호의존적 자아해석자들이 독립적 자아해석자들보다 더 코로나 우울을 경험하고 있다고 나타났다. &amp;#xD;",http://click.ndsl.kr/servlet/OpenAPIDetailView?keyValue=05787966&target=DIKO&cn=DIKO0015782072,0.7457,"공통 키워드: 코로나19, 나타났다, 변화가, 따라, 소비, 따른",추천,paper
3,농어촌 정보화의 포스트 코로나 대응 변화에 대한 사례 연구: 해외 농어촌 정보화 정책의 코로나19 시기 변화 방향을 중심으로,"2019년 12월부터 진행된 코로나19(Covid-19)의 팬데믹 상황이 지속되면서, 많은 산업 분야에서 IT 융합형 비대면 서비스와 무인화 서비스의 수요가 높아지고 있으며, 이에 따라 관련 기술 및 사회적 인프라의 구축에 대한 관심과 활용 분야에 대한 관심이 빠르게 늘어나고 있다. 이러한 사회적 변화와 함께 고려할 것은 디지털 격차(Digital Divide), 즉 도시 지역에서 생활하는 일반국민 계층이 누리는 디지털 서비스의 수준을 100으로 두었을 때, 농어촌 주민, 고령층, 장애인, 저소득층 등의 4대 소외계층이 체감하는 격차를 평가하는 것이다(한국지능정보사회진흥원, 2021). 문제는 이러한 4대 소외계층과 신소외계층의 다수가 농어촌 거주민에 속한다는 점이다. 본 연구는 이러한 농어촌 지역이 겪고 있는 디지털 격차, 이른바 스마트 격차를 해소하기 위한 정책적 대안을 국내외 관련 사례 연구를 통해 제시하고자 한다. 본 연구는 유럽지역의 대표적인 농어촌 지역 정보화 성공 사례를 분석하고, 각 사례의 장점과 단점에 기반하여 농어촌 지역 정보화의 핵심 요인을 도출하는 것을 목적으로 한다. 사례 분석 결과, 유럽 지역은 한국보다 많은 비중을 차지하는 농어촌 지역의 정보화를 단순한 IT활용 격차의 감소보다는 경제력과 지역의 자체적인 성장 동력을 확보하는 차원에서 검토, 추진하고 있으며, 코로나19에 대응해서는 기존의 현장 활용 중심의 IT교육과 인프라 육성을 탈피하고 개별적으로 비대면 정보화 서비스를 활용할 수 있도록 변화하는 것을 강조하고 있다.",http://click.ndsl.kr/servlet/OpenAPIDetailView?keyValue=05787966&target=NART&cn=JAKO202132648286410,0.6926,"공통 키워드: 코로나19, 중심으로, 변화에, 사회적, 이러한, 이에",참고,paper
4,'코로나-19 : 우리의 기억' : 코로나바이러스 감염증과 사회변화에 대한 디지털 아카이브,"코로나바이러스감염증은 인류사회가 경험하지 못한 커다란 충격과 생활양식의 급속한 변화를 만들고 있다. 비대면 사회는 감염병 확산을 예방하기 위한 과정에서 보편화된 사례이다. 코로나바이러스감염증으로 인한 사회적 영향은 광범위하다. 정부의 정책, 개인 정보보호, 정보기술 등 다양한 이슈가 사회 전반에 영향을 주고 있다. 동시에 관련 사건과 이슈가 신속하고 빠르게 변하기 때문에 사실 정보를 추적하고 기록하는 것이 어렵다. 코로나-19와 실시간성 정보를 효과적으로 기술하기 위한 방안은 무엇일까? '코로나-19:우리의 기억' 프로젝트는 코로나바이러스감염증에 대한 사회문화적 영향을 가치중립적으로 기록하기 위한 시도이다. 주요 사건과 이슈를 분야별로 수집하고, 중립적인 관점으로 핵심이벤트를 기록하며, 모든 기록을 탐색할 수 있도록 디지털 아카이브로 구축한다. 프로젝트를 통해 수집, 구축한 모든 데이터, 소스코드, 시각화를 포함하는 애플리케이션은 모두 공개하여 새로운 협업을 이끌어내고 있다.",http://click.ndsl.kr/servlet/OpenAPIDetailView?keyValue=05787966&target=NART&cn=JAKO202033759424935,0.6812,"공통 키워드: 변화를, 사회적, 다양한, 이슈를, 주요",참고,paper
5,포스트 코로나 시대의 신유통(新零售)에 관한 검토,"With the spread of Corona19, social distancing became commonplace. And offline purchasing activities are rapidly moving online. For e-commerce expansion, many changes have begun in the online and offline markets, and these changes are accelerating further with Corona19. This study reviewed the field of fresh food, where ‘New Retail,’ meaning convergence of ‘online, offline and logistics,’ is being introduced the fastest. In China, online companies such as Alibaba and JD.com are rapidly expanding their offline areas. In the US, Amazon, which represents online, and Wal-Mart, which represents offline, form a competitive structure between online and offline. It is expected that online and offline convergence environments will become more serious in the post-corona era. Domestic online and offline companies would need to prepare for the new retail environment by strengthening product competitiveness, responding to mobile environment, introducing smart logistics, and expanding strategic partnerships of companies.",http://click.ndsl.kr/servlet/OpenAPIDetailView?keyValue=05787966&target=NART&cn=ART002597917,0.6612,주요 키워드가 부분적으로 유사합니다.,참고,paper
